Area,Activity Group,Activity,Type,Definition
Revenue,Wallet Transfer,Cross-Border Transfer,FX - User Exchange Difference,"In Argentina, multiple exchange rates operate alongside the official rate, reflecting the true market value of the currency. When a User performs a Cross-Border transfer to a CVU User, AstroPay applies an FX spread to the official rate, generating revenue. However, an additional revenue (or loss) arises from the difference between the official rate and the parallel market rate. This FX - User Exchange Difference revenue specifically captures the gain or loss resulting from this gap between the official and parallel rates. The true FX revenue in these markets is determined by the spread between the parallel rate and AstroPay’s FX rate."
Revenue,Wallet Transfer,Cross-Border Transfer,User Fee,"A fee that may be charged to users when transferring funds from their AstroPay account to a recipient outside the AstroPay ecosystem, utilizing external payment systems such as Brazil's Pix or Argentina's Clave Virtual Uniforme (CVU). This fee covers the costs associated with processing cross-border transactions through these external networks."
Revenue,Wallet Transfer,P2P Transfer,FX - User Exchange Difference,"In countries with parallel FX markets, such as Argentina and Nigeria, multiple exchange rates operate alongside the official rate, reflecting the true market value of the currency. When a User performs a P2P transfer, AstroPay applies an FX spread to the official rate, generating revenue. However, an additional revenue (or loss) arises from the difference between the official rate and the parallel market rate. This FX - User Exchange Difference revenue specifically captures the gain or loss resulting from this gap between the official and parallel rates. The true FX revenue in these markets is determined by the spread between the parallel rate and AstroPay’s FX rate."
Revenue,Wallet Transfer,Cross-Border Transfer,FX - User,"Revenue generated when a user transfers funds from their AstroPay account to an external recipient in a different country, requiring a currency conversion. A spread is applied to the exchange rate, representing AstroPay’s earnings from the transaction. Cross-border transfers allow users to send money internationally through payment networks such as Pix in Brazil or Clave Virtual Uniforme (CVU) in Argentina."
Revenue,Wallet Transfer,P2P Transfer,User Fee,"This fee may be applied when a user sends money to another AstroPay user, covering the cost of transactions."
Revenue,Wallet Transfer,P2P Transfer,FX - User,"Revenue generated when a user makes a P2P transfer, and the funds are converted from one currency to another. A currency exchange is performed, and a spread is applied to the exchange rate, representing the earnings from the conversion."
Revenue,Wallet Transfer,Withdrawal,FX - User Exchange Fee,"In countries with parallel FX markets, such as Argentina and Nigeria, multiple exchange rates operate alongside the official rate, reflecting the true market value of the currency. When a User performs a withdrawal on a currency that differs from their local currency, AstroPay applies an FX spread to the official rate, generating revenue. However, an additional revenue (or loss) arises from the difference between the official rate and the parallel market rate. This FX - User Exchange Difference revenue specifically captures the gain or loss resulting from this gap between the official and parallel rates. The true FX revenue in these markets is determined by the spread between the parallel rate and AstroPay’s FX rate."
Revenue,Wallet Transfer,Withdrawal,User Fee,"A fee that may be charged to users when withdrawing funds from their AstroPay wallet to their bank account. This fee can vary depending on the payment method and market regulations, and it includes specific charges such as the IOF tax in Brazil."
Revenue,Wallet Transfer,Withdrawal,FX - User,"Revenue generated when a user withdraws funds from their AstroPay wallet to their bank account, and the wallet balance is not in the user’s local currency. AstroPay converts the funds to the local currency and applies a spread to the exchange rate."
Revenue,Wallet Transfer,,,"Encompasses all outbound transfers initiated from a user’s AstroPay wallet to other users, external bank accounts, or local payment rails."
Revenue,Wallet Transfer,Withdrawal,,When a user initiates a withdrawal from their AstroPay wallet to their registered bank account.
Revenue,Wallet Transfer,P2P Transfer,,When a user transfers funds directly to another user within the AstroPay ecosystem.
Revenue,Wallet Transfer,Cross-Border Transfer,,"When a user sends funds from their AstroPay wallet to an external recipient in another country via localized payment networks (e.g., PIX in Brazil, CVU in Argentina)."
Revenue,Wallet Payment,Merchant Referral,Fee,"A revenue share received from merchants, for users who access their services through AstroPay. This fee compensates us for referring and facilitating user transactions on their platforms."
Revenue,Wallet Payment,Merchant Settlement,FX - Merchant Exchange Difference,"In Argentina, certain merchants with panels in ARS receive settlements in Euros. The settlement process involves converting ARS to USD at the official exchange rate and then to Euros. Due to the coexistence of official and parallel FX rates, this revenue represents the difference between the official exchange rate and the parallel market rate during the currency conversion process."
Revenue,Wallet Payment,Merchant Settlement,Fee,"This revenue is generated when AstroPay processes merchant settlements. The fee is applied based on the settlement amount: $250 for settlements below $12,000 USD, $90 for settlements between $12,000 and $100,000 USD and no fee for settlements exceeding $100,000 USD. This fee compensates for the administrative and operational costs of processing settlements."
Revenue,Wallet Payment,Merchant Settlement,EUR-USD Exchange,"This revenue is generated from currency conversions during merchant settlements. Although merchant balances are typically held in USD on the AstroPay panel, settlements are often paid in Euros. AstroPay converts the USD balance to Euros at its FX rate, applying a spread over the market exchange rate. The revenue comes from this FX spread."
Revenue,Wallet Payment,Merchant Withdrawal,FX - Merchant Exchange Difference,"This revenue is generated in markets with parallel FX markets, such as Argentina and Nigeria, where multiple exchange rates exist in addition to the official rate. Like the FX - User exchange difference, when AstroPay processes merchant payments or withdrawals in these markets, an FX spread is applied to the official exchange rate. However, there is also a discrepancy between the official rate and the parallel market rate. The true FX revenue in this case is derived from the spread between the parallel market rate and AstroPay's FX rate, applied to merchant transactions. The resulting difference generates either a gain or a loss, depending on the movement of these exchange rates."
Revenue,Wallet Payment,Merchant Withdrawal,FX - User Exchange Difference,"In countries with parallel FX markets, such as Argentina and Nigeria, multiple exchange rates operate alongside the official rate, reflecting the true market value of the currency. When processing merchant withdrawals, AstroPay applies an FX spread to the official rate, generating revenue. However, an additional revenue (or loss) arises from the difference between the official rate and the parallel market rate. This FX - User Exchange Difference revenue specifically captures the gain or loss resulting from this gap between the official and parallel rates. The true FX revenue in these markets is determined by the spread between the parallel rate and AstroPay’s FX rate."
Revenue,Wallet Payment,Merchant Withdrawal,FX - User,"This revenue is generated when users make withdrawals from a merchant to their wallet in a different currency than the merchant’s cashier. In these cases, the funds are converted at AstroPay’s FX rate, which includes a spread over the official exchange rate. The revenue comes from this spread."
Revenue,Wallet Payment,Merchant Withdrawal,FX - Merchant,"This revenue represents the earnings generated from foreign exchange rate differentials when settling merchant withdrawals. AstroPay maintains a panel that tracks all transactions, typically in USD. However, when merchants operate their sites in other currencies (e.g., INR, ARS, BRL), these transactions (merchant withdrawals) are converted to USD using AstroPay’s FX rate, which differs from the official exchange rate. The revenue arises from the spread between AstroPay’s FX rate and the official rate."
Revenue,Wallet Payment,Merchant Withdrawal,Fee,"The fee charged to the merchant is determined by a prior agreement and varies based on the monthly merchant withdrawal volume generated by the merchant, as well as the origin of the volume by region or country. Merchants typically adhere to a tiered fee structure that adjusts according to volume and geographic source."
Revenue,Wallet Payment,Merchant Payment,Rebates,"They refer to the amount of money AstroPay returns to merchants or charges them less as part of an agreement based on the volume of transactions they process. The fee percentage applied to the merchant depends on the monthly volume of DOP they generate. As merchants hit certain transaction volume thresholds, they qualify for reduced fees or rebates, which lower the percentage charged. These rebates are typically a form of incentive to encourage higher transaction volumes, benefiting both the merchant and AstroPay by maintaining a favorable fee structure. The rebates are calculated based on the agreed-upon fee schedule linked to the merchant’s transaction volume for the month."
Revenue,Wallet Payment,Merchant Payment,FX - Merchant Exchange Difference,"This revenue is generated in markets with parallel FX markets, such as Argentina and Nigeria, where multiple exchange rates exist in addition to the official rate. Like the FX - User exchange difference, when AstroPay processes merchant payments or withdrawals in these markets, an FX spread is applied to the official exchange rate. However, there is also a discrepancy between the official rate and the parallel market rate. The true FX revenue in this case is derived from the spread between the parallel market rate and AstroPay's FX rate, applied to merchant transactions. The resulting difference generates either a gain or a loss, depending on the movement of these exchange rates."
Revenue,Wallet Payment,Merchant Payment,FX - User Exchange Difference,"In countries with parallel FX markets, such as Argentina and Nigeria, multiple exchange rates operate alongside the official rate, reflecting the true market value of the currency. When processing merchant payments or withdrawals, AstroPay applies an FX spread to the official rate, generating revenue. However, an additional revenue (or loss) arises from the difference between the official rate and the parallel market rate. This FX - User Exchange Difference revenue specifically captures the gain or loss resulting from this gap between the official and parallel rates. The true FX revenue in these markets is determined by the spread between the parallel rate and AstroPay’s FX rate."
Revenue,Wallet Payment,Merchant Payment,FX - User,"This revenue is generated when users make payments to a merchant in a different currency than the merchant’s cashier. In these cases, the funds are converted at AstroPay’s FX rate, which includes a spread over the official exchange rate. The revenue comes from this spread."
Revenue,Wallet Payment,Merchant Payment,FX - Merchant,"This revenue represents the earnings generated from foreign exchange rate differentials when settling merchant payments. AstroPay maintains a panel that tracks all transactions, typically in USD. However, when merchants operate their sites in other currencies (e.g., INR, ARS, BRL), these transactions (merchant payments) are converted to USD using AstroPay’s FX rate, which differs from the official exchange rate. The revenue arises from the spread between AstroPay’s FX rate and the official rate."
Revenue,Wallet Payment,Merchant Payment,Fee,"The fee charged to the merchant is determined by a prior agreement and varies based on the monthly merchant payment volume generated by the merchant, as well as the origin of the volume by region or country. Merchants typically adhere to a tiered fee structure that adjusts according to volume and geographic source."
Revenue,Wallet Payment,,,"Covers transactions in which users transfer funds from their AstroPay wallet to a merchant, excluding full gateway flows."
Revenue,Wallet Payment,Merchant Payment,,"When a user makes a payment from their AstroPay wallet to a merchant (e.g., a gambling or e-commerce site). Includes standard deposits and One-Touch flows. Does not include Full Gateway payments."
Revenue,Wallet Deposit,Wallet Deposit,FX - User Exchange Difference,"In countries with parallel FX markets, such as Argentina and Nigeria, multiple exchange rates operate alongside the official rate, reflecting the true market value of the currency. When a User performs a wallet deposit paying on a different currency than the wallet currency, AstroPay applies an FX spread to the official rate, generating revenue. However, an additional revenue (or loss) arises from the difference between the official rate and the parallel market rate. This FX - User Exchange Difference revenue specifically captures the gain or loss resulting from this gap between the official and parallel rates. The true FX revenue in these markets is determined by the spread between the parallel rate and AstroPay’s FX rate."
Revenue,Wallet Deposit,Wallet Deposit,FX - User,"Revenue generated when a user funds their AstroPay wallet using a currency different from the one they intend to use for payments. A currency conversion is performed, and a spread is applied to the exchange rate, representing the earnings from the transaction."
Revenue,Wallet Deposit,Wallet Deposit,User Fee,"A fee that may be charged to users when funding their AstroPay wallet. This fee can vary depending on the payment method and market regulations, and it includes specific charges such as the IOF tax in Brazil."
Revenue,Wallet Deposit,,,Covers all activities where users add funds to their AstroPay wallet using local currency.
Revenue,Wallet Deposit,Wallet Deposit,,"When a user funds their AstroPay wallet using a supported local payment method (e.g., bank transfer, PIX, CVU). Only local currencies are accepted in this process."
Revenue,Wallet Balance,User Wallet,,"Revenue derived from user wallet balances that remain unclaimed for a prolonged period, or from users in discontinued markets where funds can no longer be withdrawn."
Revenue,Wallet Balance,User Wallet,Expired Balance,"Revenue generated from user account balances that remain unclaimed for an extended period or from markets that AstroPay has discontinued. When users do not withdraw their funds within the specified timeframe, these balances expire and are recognized as earnings."
Revenue,Wallet Balance,AstroPoints,Expired Balance,Revenue generated from expired AstroPoints that were not redeemed within their one-year validity period. AstroPoints are awarded to users for specific actions on AstroPay and have a cost of USD 0.0001 per point. When points expire—either due to inactivity or account purges in discontinued markets—the associated cost is reversed and recognized as earnings.
Revenue,Wallet Balance,Other Gains,Other Gains,"Revenue derived from differences between AstroPay’s accounting records, and the amounts reported by payment processors. These discrepancies may result from factors such as timing differences, rounding adjustments, or reconciliation variances."
Revenue,Wallet Balance,Currency Exchange,FX - User Exchange Difference,"In countries with parallel FX markets, such as Argentina and Nigeria, multiple exchange rates operate alongside the official rate, reflecting the true market value of the currency. When a User performs a currency exchange, AstroPay applies an FX spread to the official rate, generating revenue. However, an additional revenue (or loss) arises from the difference between the official rate and the parallel market rate. This FX - User Exchange Difference revenue specifically captures the gain or loss resulting from this gap between the official and parallel rates. The true FX revenue in these markets is determined by the spread between the parallel rate and AstroPay’s FX rate."
Revenue,Wallet Balance,Currency Exchange,User Fee,"A fee that may be charged to users when converting currencies within their AstroPay wallet. This category also includes specific regulatory charges, such as the IOF tax in Brazil."
Revenue,Wallet Balance,Currency Exchange,FX - User,"Revenue earned when a user exchanges one currency for another within their AstroPay wallet. The transaction is processed at an exchange rate that includes a spread, which represents our earnings from the currency conversion."
Revenue,Wallet Balance,Wallet Balance,Interest Income,The earnings generated from investing the funds held by our customers in their AstroPay accounts. This represents the interest accrued on these balances while they remain within our ecosystem.
Revenue,Wallet Balance,,,"Includes activities that affect the user’s wallet balance, excluding direct payments, deposits, and withdrawals."
Revenue,Wallet Balance,Wallet Balance,,Activity through which AstroPay and its users generate revenue by investing wallet and company funds in financial instruments.
Revenue,Wallet Balance,Currency Exchange,,When a user performs a currency conversion inside the AstroPay wallet. This activity typically generates revenue through spread margins.
Revenue,Wallet Balance,Other Gains,,"Revenue derived from discrepancies between AstroPay’s internal accounting and the amounts reported by payment processors. These may arise due to timing differences, rounding, or reconciliation adjustments."
Revenue,Wallet Balance,Astropoints,,Revenue generated from expired AstroPoints that were not redeemed within their one-year validity window.
Revenue,Payment Processing,Merchant Settlement,Fee,"This revenue is generated when AstroPay processes merchant settlements. The fee is applied based on the settlement amount: $250 for settlements below $12,000 USD, $90 for settlements between $12,000 and $100,000 USD and no fee for settlements exceeding $100,000 USD. This fee compensates for the administrative and operational costs of processing settlements. Only applies for merchants that function under the Full Gateway operation."
Revenue,Payment Processing,Merchant Settlement,EUR-USD Exchange,"This revenue is generated from currency conversions during merchant settlements. Although merchant balances are typically held in USD on the AstroPay panel, settlements are often paid in Euros. AstroPay converts the USD balance to Euros at its FX rate, applying a spread over the market exchange rate. The revenue comes from this FX spread. Only applies for merchants that function under the Full Gateway operation."
Revenue,Payment Processing,Merchant Withdrawal,FX - Merchant Exchange Difference,"This revenue is generated in markets with parallel FX markets, such as Argentina and Nigeria, where multiple exchange rates exist in addition to the official rate. Like the FX - User exchange difference, when AstroPay processes merchant payments or withdrawals in these markets, an FX spread is applied to the official exchange rate. However, there is also a discrepancy between the official rate and the parallel market rate. The true FX revenue in this case is derived from the spread between the parallel market rate and AstroPay's FX rate, applied to merchant transactions. The resulting difference generates either a gain or a loss, depending on the movement of these exchange rates. Only applies for merchants that function under the Full Gateway operation."
Revenue,Payment Processing,Merchant Withdrawal,FX - Merchant,"This revenue represents the earnings generated from foreign exchange rate differentials when settling merchant withdrawals. AstroPay maintains a panel that tracks all transactions, typically in USD. However, when merchants operate their sites in other currencies (e.g., INR, ARS, BRL), these transactions (merchant withdrawals) are converted to USD using AstroPay’s FX rate, which differs from the official exchange rate. The revenue arises from the spread between AstroPay’s FX rate and the official rate. Only applies for merchants that function under the Full Gateway operation."
Revenue,Payment Processing,Merchant Withdrawal,Fee,"The fee charged to the merchant is determined by a prior agreement and varies based on the monthly merchant withdrawal volume generated by the merchant, as well as the origin of the volume by region or country. Merchants typically adhere to a tiered fee structure that adjusts according to volume and geographic source. Only applies for merchants that function under the Full Gateway operation."
Revenue,Payment Processing,Merchant Payment,Rebates,"They refer to the amount of money AstroPay returns to merchants or charges them less as part of an agreement based on the volume of transactions they process. The fee percentage applied to the merchant depends on the monthly volume of DOP they generate. As merchants hit certain transaction volume thresholds, they qualify for reduced fees or rebates, which lower the percentage charged. These rebates are typically a form of incentive to encourage higher transaction volumes, benefiting both the merchant and AstroPay by maintaining a favorable fee structure. The rebates are calculated based on the agreed-upon fee schedule linked to the merchant’s transaction volume for the month. Only applies for merchants that function under the Full Gateway operation."
Revenue,Payment Processing,Merchant Payment,FX - Merchant Exchange Difference,"This revenue is generated in markets with parallel FX markets, such as Argentina and Nigeria, where multiple exchange rates exist in addition to the official rate. Like the FX - User exchange difference, when AstroPay processes merchant payments or withdrawals in these markets, an FX spread is applied to the official exchange rate. However, there is also a discrepancy between the official rate and the parallel market rate. The true FX revenue in this case is derived from the spread between the parallel market rate and AstroPay's FX rate, applied to merchant transactions. The resulting difference generates either a gain or a loss, depending on the movement of these exchange rates. Only applies for merchants that function under the Full Gateway operation."
Revenue,Payment Processing,Merchant Payment,FX - Merchant,"This revenue represents the earnings generated from foreign exchange rate differentials when settling merchant payments. AstroPay maintains a panel that tracks all transactions, typically in USD. However, when merchants operate their sites in other currencies (e.g., INR, ARS, BRL), these transactions (merchant payments) are converted to USD using AstroPay’s FX rate, which differs from the official exchange rate. The revenue arises from the spread between AstroPay’s FX rate and the official rate. Only applies for merchants that function under the Full Gateway operation."
Revenue,Payment Processing,Merchant Payment,Fee,"The fee charged to the merchant is determined by a prior agreement and varies based on the monthly merchant payment volume generated by the merchant, as well as the origin of the volume by region or country. Merchants typically adhere to a tiered fee structure that adjusts according to volume and geographic source. Only applies for merchants that function under the Full Gateway operation."
Revenue,Payment Processing,,,Groups transactions involving payments and withdrawals to or from merchants using AstroPay through the full gateway integration. Currently available only in Brazil.
Revenue,Payment Processing,Merchant Payment,,When a user performs a payment to a full gateway-integrated merchant using funds from their AstroPay wallet.
Revenue,Payment Processing,Merchant Withdrawal,,When a user initiates a withdrawal from a full gateway-integrated merchant back to their AstroPay wallet.
Revenue,Payment Processing,Merchant Settlement,,"When a full gateway merchant requests settlement from AstroPay, receiving funds corresponding to their net merchant payments, after deducting merchant withdrawals and applicable fees."
Revenue,Other Services,Esim,User Fee,"When a user purchases an internet plan through the AstroPay app, the eSIM card is purchased in USD. If the user does not hold a USD balance, a foreign exchange (FX) conversion is executed at the time of purchase. An FX spread is applied to the exchange rate and included in the amount charged to the user."
Revenue,Other Services,Billpay,FX - User Exchange Difference,"In Argentina, multiple exchange rates operate alongside the official rate, reflecting the true market value of the currency. When a User performs a bill payment in a currency that differs from the bill’s currency, AstroPay applies an FX spread to the official rate, generating revenue. However, an additional revenue (or loss) arises from the difference between the official rate and the parallel market rate. This FX - User Exchange Difference revenue specifically captures the gain or loss resulting from this gap between the official and parallel rates. The true FX revenue in these markets is determined by the spread between the parallel rate and AstroPay’s FX rate."
